category,keywords
Billing,"billing, insurance, fee, out of pocket, scam, billing team, billing balance, billing department,  amount, payment, copay, insurance handling, cash, billing discrepancy, insurance company, billing practice,  cost, billing call center, co-pay, bill pay,  billing error,  money covered, wrong bill, billing issue, payment form, billing problem, collections, PFC"
Clinical Care and Outcomes,"treatment, expert, health care provider, health journey, nurse practitioner, expertise, personalized, virtual care, effective treatment, evaluation, knowledgeable, counselor, CBT, meds, psychiatrist, provider, health provider, telehealth, DBT, understanding, physician, helpful, psychologist, knowledge, therapist, virtual session, clinician, tele-health, test, practitioner, therapy, testing, medication, therapists, IOP, services, improvement, doctor, psychiatrist, healthcare provider, prescription, specialist, telehealth, progress, care, continuity, provider late, didn't join, inattentive, distracted, unprepared, late to sessions, canceled last minute, robotic, impersonal, lack of empathy, misdiagnosis, inappropriate questioning, accusatory, judgmental, poor listening, dismissive, inexperienced, new license, uncomfortable prescribing, limited session duration, medication errors, delayed, short refills, prior authorization issues, gaslighting, blame-shifting, trauma/PTSD treatment inadequate, telehealth visit,"
Intake Experience,"booking, wait, book, customer service, available, online booking, availability, call center, call back,  appointment booking, call drops, scheduling, book appointment,  client service,  customer care, support staff, schedule, make an appointment,  booking experience"
Operations,"front desk, office manager, accessibility, center, office experience, comfort, desk staff, access, front office, patient experience, comfortable, office staff, safety, safe, location, facility, ADA, accessible, charged wrong, form, phone system, support, cancellation fee, charged wrong, charge error, cancellation, billing inaccuracy, late fee, cancellation policy, wait time, no answer, phone line, on hold, delays, overbooked, operational error, miscommunication, lost paperwork, front desk attitude, office environment, noise, privacy concerns, front office training, location convenience, office closed, unexpected closures, holiday hours, process confusion"
Technology,"digital, phreesia, virtual, website, check in tedious, vsee, video, online portal, check-in site, telehealth, time consuming, digital check-in, questionnaire, patient portal, portal, Zoom, login issue, password reset, website down, system glitch, lag, frozen screen, audio issues, video issues, camera not working, connection lost, dropped call, tech support, software update, browser issue, device compatibility, slow loading, error message, portal crash, telehealth link not working, system outage, digital forms, mobile issues, desktop issues"
Brand,"private, equity, LifeStance, profit, company, money grab, corporate, not patient-centered, greedy, profit-focused, organization, leadership, management, ownership, chain clinic, nationwide, conglomerate, impersonal company, brand reputation, mission, values, trust, transparency, big corporation"
